SOCP,SOCP_desc,SOCP_map,SOCP_desc_map,SOCP_desc_map2,SCHL,SCHL_desc,SCHL_map,SCHL_desc_map,,FOD1P,FOD1P_desc,FOD1P_map,FOD1P_desc_map,FOD1P_desc_map2,FOD2P,FOD2P_desc,FOD2P_map,FOD2P_desc_map
532010,TRN-Aircraft Pilots And Flight Engineers,24,TRN,TRN,,,,,,,,,,,,,,
532020,TRN-Air Traffic Controllers And Airfield Operations Specialists,24,TRN,TRN,,,,,,,,,,,,,,
532031,TRN-Flight Attendants,24,TRN,TRN,,,,,,,,,,,,,,
533011,"TRN-Ambulance Drivers And Attendants, Except Emergency Medical Technicians",24,TRN,TRN,,,,,,,,,,,,,,
533030,TRN-Driver/Sales Workers And Truck Drivers,24,TRN,TRN,,,,,,,,,,,,,,
533051,"TRN-Bus Drivers, School",24,TRN,TRN,,,,,,,,,,,,,,
533052,"TRN-Bus Drivers, Transit And Intercity",24,TRN,TRN,,,,,,,,,,,,,,
533053,TRN-Shuttle Drivers and Chauffeurs,24,TRN,TRN,,,,,,,,,,,,,,
533054,TRN-Taxi Drivers,24,TRN,TRN,,,,,,,,,,,,,,
533099,"TRN-Motor Vehicle Operators, All Other",24,TRN,TRN,,,,,,,,,,,,,,
534010,TRN-Locomotive Engineers And Operators,24,TRN,TRN,,,,,,,,,,,,,,
534031,TRN-Railroad Conductors And Yardmasters,24,TRN,TRN,,,,,,,,,,,,,,
5340XX,TRN-Other Rail Transportation Workers,24,TRN,TRN,,,,,,,,,,,,,,
535020,TRN-Ship And Boat Captains And Operators,24,TRN,TRN,,,,,,,,,,,,,,
5350XX,"TRN-Sailors And Marine Oilers, And Ship Engineers",24,TRN,TRN,,,,,,,,,,,,,,
536021,TRN-Parking Attendants,24,TRN,TRN,,,,,,,,,,,,,,
536030,TRN-Transportation Service Attendants,24,TRN,TRN,,,,,,,,,,,,,,
536051,TRN-Transportation Inspectors,24,TRN,TRN,,,,,,,,,,,,,,
536061,TRN-Passenger Attendants,24,TRN,TRN,,,,,,,,,,,,,,
5360XX,TRN-Other Transportation Workers,24,TRN,TRN,,,,,,,,,,,,,,
537021,TRN-Crane And Tower Operators,24,TRN,TRN,,,,,,,,,,,,,,
537051,TRN-Industrial Truck And Tractor Operators,24,TRN,TRN,,,,,,,,,,,,,,
537061,TRN-Cleaners Of Vehicles And Equipment,24,TRN,TRN,,,,,,,,,,,,,,
537062,"TRN-Laborers And Freight, Stock, And Material Movers, Hand",24,TRN,TRN,,,,,,,,,,,,,,
537063,TRN-Machine Feeders And Offbearers,24,TRN,TRN,,,,,,,,,,,,,,
537064,"TRN-Packers And Packagers, Hand",24,TRN,TRN,,,,,,,,,,,,,,
537065,TRN-Stockers And Order Fillers,24,TRN,TRN,,,,,,,,,,,,,,
537070,TRN-Pumping Station Operators,24,TRN,TRN,,,,,,,,,,,,,,
537081,TRN-Refuse And Recyclable Material Collectors,24,TRN,TRN,,,,,,,,,,,,,,
5370XX,"TRN-Conveyor, Dredge, And Hoist And Winch Operators",24,TRN,TRN,,,,,,,,,,,,,,
5371XX,TRN-Other Material Moving Workers,24,TRN,TRN,,,,,,,,,,,,,,
551010,MIL-Military Officer Special And Tactical Operations Leaders,25,MIL,MIL,,,,,,,,,,,,,,
552010,MIL-First-Line Enlisted Military Supervisors,25,MIL,MIL,,,,,,,,,,,,,,
553010,MIL-Military Enlisted Tactical Operations And Air/Weapons Specialists And Crew Members,25,MIL,MIL,,,,,,,,,,,,,,
559830,"MIL-Military, Rank Not Specified",25,MIL,MIL,,,,,,,,,,,,,,
999920,"Unemployed, With No Work Experience In The Last 5 Years Or Earlier Or Never Worked",26,Une,Une,,,,,,,,,,,,,,
